_id,Summary
67299dbda23f7e5639814e0e,Test that the internal HTTP request is correctly built and executed .
67299dbda23f7e5639814e0f,Not available.
67299dbda23f7e5639814e10,Tracks the failure by adding the exception to the suppressed exceptions list and setting it as the main exception if it is not already set.
67299dbda23f7e5639814e11,Returns the settings for the rest client with basic authentication using the admin user and the default password .
67299dbda23f7e5639814e12,Runs a script and returns the result.
67299dbda23f7e5639814e13,Runs a container with the given distribution and DockerRun configuration.
67299dbda23f7e5639814e14,"Run a container using the given distribution and builder, and return an Installation object representing the container."
67299dbda23f7e5639814e15,Create parameters for the test suite.
67299dbda23f7e5639814e16,Starts initializing shards and reroutes them to the given routing node.
67299dbda23f7e5639814e17,Connects to a given node using the provided transport service.
67299dbda23f7e5639814e18,Stops a random data node in the cluster.
67299dbda23f7e5639814e19,Sets up a mock TransportService with a mock ThreadPool and returns the mock TransportService.
67299dbda23f7e5639814e1a,Rewrites the given query using the provided shard rewrite context and ensures that the rewritten query is serializable.
67299dbda23f7e5639814e1b,Executes the given code block repeatedly until it either succeeds or the timeout is reached.
67299dbda23f7e5639814e1c,Returns the range of ports used by the worker nodes.
67299dbda23f7e5639814e1d,Returns a SecureRandom instance using the FIPS algorithm.
67299dbda23f7e5639814e1e,Creates an index with the given name and default settings.
67299dbda23f7e5639814e1f,Adds a rule that will make the transport service unresponsive for the given duration when trying to connect to the specified transport address. This is useful for simulating network failures during testing.
67299dbda23f7e5639814e20,Ensures that the cluster is in a healthy state before starting a network disruption. This method checks for active disruptions and ensures that the cluster has the correct number of nodes and is fully connected.
67299dbda23f7e5639814e21,Waits for all pending tasks to complete on the given rest client.
67299dbda23f7e5639814e22,"Resets the feature states for the current cluster, if supported."
67299dbda23f7e5639814e23,Returns the settings for the REST client used for administrative requests.
67299dbda23f7e5639814e24,Updates the cluster settings using the given settings object.
67299dbda23f7e5639814e25,Dispatches the given request to the controller and verifies the response .
67299dbda23f7e5639814e26,Looks up a binary method handle for the given classes and name.
67299dbda23f7e5639814e27,Returns a MethodHandle that can be used to normalize an index into a list or map.
67299dbda23f7e5639814e28,Finds the result of applying a function to each element in a collection.
67299dbda23f7e5639814e29,Checks the user expression node for errors and throws exceptions if necessary
67299dbda23f7e5639814e2a,Add additional field to the map if the property is contained in the list and the value is not empty.
67299dbda23f7e5639814e2b,Specifies whether to ignore unmapped fields when executing the query.
67299dbda23f7e5639814e2c,Test the decode and encode functions for the ScaledFloatFieldMapper class.
67299dbda23f7e5639814e2d,Stop the APM server instance.
67299dbda23f7e5639814e2e,"Deletes the given path, retrying if necessary."
67299dbda23f7e5639814e2f,Syncs the source directory with the destination directory using hard links.
67299dbda23f7e5639814e30,"Register a client with the given clientId, clientSecret and redirectUri."
67299dbda23f7e5639814e31,"Pauses the execution of the watch, cancelling any queued tasks."
67299dbda23f7e5639814e32,Clears the allocation ids and returns true if there were any previous ids.
67299dbda23f7e5639814e33,Called after an index operation has completed.
67299dbda23f7e5639814e34,Called before a delete is executed on the engine.
67299dbda23f7e5639814e35,Filters out any settings that are not allowed to be set by the user.
67299dbda23f7e5639814e36,"Registers a new execution with the given id and execution object. Returns true if the execution was successfully registered, false if an execution with the same id already exists."
67299dbda23f7e5639814e37,"Pauses the execution service and clears any pending executions, returning the number of cleared executions."
67299dbda23f7e5639814e38,"Clears all executions and the queue, and returns the number of cancelled tasks."
67299dbda23f7e5639814e39,Creates triggered watches and contexts from the given events.
67299dbda23f7e5639814e3a,Clears all executions and waits for them to stop.
67299dbda23f7e5639814e3b,"Returns the concrete index for the given index name, or null if the index does not exist ."
67299dbda23f7e5639814e3c,Checks if the given time is after the scheduled time and returns the previous scheduled time if it is.
67299dbda23f7e5639814e3d,"Removes the value associated with the given key from the map and returns it as the specified type. If the value cannot be cast to the specified type, an exception is thrown."
67299dbda23f7e5639814e3e,Moves the model ID from the task settings to the service settings if it is not already present in the service settings.
67299dbda23f7e5639814e3f,"Positions the parser at the next token after the specified field. If the field is not found, an exception is thrown."
67299dbda23f7e5639814e40,Calculates the time to reserve for the given number of tokens.
67299dbda23f7e5639814e41,Reserve the specified number of tokens and return the time value for the reservation.
67299dbda23f7e5639814e42,Test that the shard status is complete when a node is shut down on non-data nodes.
67299dbda23f7e5639814e43,Syncronously renews the retention lease on the leader shard.
67299dbda23f7e5639814e44,Validates that the leader and follower index settings are identical .
67299dbda23f7e5639814e45,"Returns a view of the given list based on the specified limit and offset values. If the limit is negative, the list is reversed before applying the limit. If the size of the list is greater than or equal to the total limit, the sublist from the offset to the total limit is returned. If the size of the list is smaller than the absolute value of the limit, the entire list is returned. Otherwise, the sublist from the end of the list to the absolute value of the limit is returned."
67299dbda23f7e5639814e46,Checks if there are any following candidates for the given stage.
67299dbda23f7e5639814e47,"Returns the substring between the first occurrence of left and the last occurrence of right in the given string, or an empty string if either left or right is not found."
67299dbda23f7e5639814e48,"Records an error in retrieving a policy for an index, and sets the step info for the index to reflect the error."
67299dbda23f7e5639814e49,"Adds an ILM history item to the index asynchronously. If ILM history is not enabled, the item will not be recorded."
67299dbda23f7e5639814e4a,"Finds the best jobs for the given source and set of job capabilities. There is an opportunity to optimize the returned caps to find the minimal set of required caps. For example, one leaf may have equally good jobs [A,B], while another leaf finds only job [B] to be best. If job A is a subset of job B, we could simply search job B in isolation and get the same results. We can't do that today, because we don't (yet) have way of determining if one job is a sub/super set of another."
67299dbda23f7e5639814e4b,Freezes the clock at the current time.
67299dbda23f7e5639814e4c,Unfreezes the clock by resetting it to the system clock with the current time zone.
67299dbda23f7e5639814e4d,Fast forwards the clock by the specified number of seconds.
67299dbda23f7e5639814e4e,Rewinds the clock by the specified number of seconds.
67299dbda23f7e5639814e4f,Checks if the license is currently active by checking against the status of the license.
67299dbda23f7e5639814e50,"Checks if the given state is allowed and starts tracking if it is. Returns true if the state is allowed, false otherwise."
67299dbda23f7e5639814e51,Checks if the given XPackLicenseState allows this feature without tracking its usage.
67299dbda23f7e5639814e52,Updates the last checked and last met condition timestamps and resets the acknowledgement status for all actions if the condition is not met.
67299dbda23f7e5639814e53,Creates a rounding object for the date histogram group config.
67299dbda23f7e5639814e54,Tests whether the given expression is a valid cron expression.
67299dbda23f7e5639814e55,"Create a response for the given document ID, headers, and response object, and pass it to the given listener."
67299dbda23f7e5639814e56,"Get the response for the given async execution id, optionally restoring the response headers."
67299dbda23f7e5639814e57,"Sets the internal user for the security context, using the provided internal user and transport version."
67299dbda23f7e5639814e58,"Checks if the given action is allowed for any of the groups in the list. If the action is a mapping update action, also checks if any of the groups have a privilege that grants mapping updates for BWC."
67299dbda23f7e5639814e59,Validates the given application name.
67299dbda23f7e5639814e5a,Verifies a given hash against a SecureString data using a Hasher object.
67299dbda23f7e5639814e5b,Writes the authentication object to the context and adds the encoded header to the context header .
67299dbda23f7e5639814e5c,"Generate a salt for use with the BCrypt.hashpw() method, selecting a reasonable default for the number of hashing rounds to apply"
67299dbda23f7e5639814e5d,Generates a salt for use with the BCrypt hash function.
67299dbda23f7e5639814e5e,"Returns true if align checkpoints is disabled in the settings, false otherwise."
67299dbda23f7e5639814e5f,Create a mask to identify short fields in a delimited text structure.
67299dbda23f7e5639814e60,"Compares two rows of a delimited text file using the Levenshtein distance algorithm, taking into account only the fields specified in the given BitSet."
67299dbda23f7e5639814e61,Calculates the weights for each matched format based on the number of matches and the weight of each match.
67299dbda23f7e5639814e62,Decides if the given sample can be used to create a text structure.
67299dbda23f7e5639814e63,"Replaces expressions in the target list with the given pattern, using the provided replacer function. Returns true if any replacements were made."
67299dbda23f7e5639814e64,Combines a list of queries into a single query using the given clause.
67299dbda23f7e5639814e65,"Converts a long to a Number, treating it as an unsigned long."
67299dbda23f7e5639814e66,"Counts the number of repeated coordinates in reverse order, starting from the last coordinate."
67299dbda23f7e5639814e67,"Adjusts the circuit breaker based on the delta value. If the delta is positive, it may potentially trip the breaker. If the delta is negative, it will not trip the breaker."
67299dbda23f7e5639814e68,Computes the median value of a list of integers in ascending order.
67299dbda23f7e5639814e69,Checks if the given rounding is valid for the given range.
67299dbda23f7e5639814e6a,"Evaluates the MvMax function for an ascending index, handling null values."
67299dbda23f7e5639814e6b,Schedule snapshot jobs based on the snapshot lifecycle metadata in the cluster state.
67299dbda23f7e5639814e6c,Generates a set of random ByteRanges with the given length.
67299dbda23f7e5639814e6d,"Finish the read operation, releasing all permits and marking all bytes as accounted for."
67299dbda23f7e5639814e6e,Checks if a node is safe to be shut down by comparing its shutdown start time with the current time.
67299dbda23f7e5639814e6f,Finish reporting of datafeed timing stats .
67299dbda23f7e5639814e70,Vacate the node with the given reason.
67299dbda23f7e5639814e71,"Finds the common prefix between the input bytes and the offsets, and returns the corresponding value if a leaf is found."
67299dbda23f7e5639814e72,Returns the top transaction IDs from the transaction store.
67299dbda23f7e5639814e73,Returns the top item ids from the transaction store.
67299dbda23f7e5639814e74,Compute the logarithm of the probability mass function for a binomial distribution.
67299dbda23f7e5639814e75,"Calculate the log of the binomial probability for a given x, n, p, and q."
67299dbda23f7e5639814e76,Returns true if the memory tracker has been recently refreshed and is not stale.
67299dbda23f7e5639814e77,Returns the memory requirement for an anomaly detector job.
67299dbda23f7e5639814e78,Get the memory requirement for a data frame analytics job.
67299dbda23f7e5639814e79,Refreshes the memory tracker with the latest persistent tasks and their memory usage.
67299dbda23f7e5639814e7a,Waits for a flush acknowledgement for the given flush ID within the specified timeout. Returns null if the flush failed.
67299dbda23f7e5639814e7b,Builds a TimeRange object using the specified start and end times.
67299dbda23f7e5639814e7c,Deletes all annotations for all jobs.
67299dbda23f7e5639814e7d,"Persists a bucket in the index, along with its influencers."
67299dbda23f7e5639814e7e,Deletes the interim results for the given job.
67299dbda23f7e5639814e7f,Flushes the bulk and executes the given listener when complete.
67299dbda23f7e5639814e80,Tests the inflation of a bounded tiler with a specific H3 cell and precision.
67299dbda23f7e5639814e81,Sets the value of the given GeoShapeCellValues object with the encoded tile coordinates if they are valid. Returns the number of cells set.
67299dbda23f7e5639814e82,Checks if the bounding box intersects with the given coordinates.
67299dbda23f7e5639814e83,"Relates a point to the GeoHex grid, returning the appropriate GeoRelation."
67299dbda23f7e5639814e84,Returns the generation of the last commit in the given files.
67299dbda23f7e5639814e85,Skips the final output of the provided data input.
67299dbda23f7e5639814e86,Generates a valid random instance name by checking if the name is valid using the Name class.
67299dbda23f7e5639814e87,Creates a user with a run as role using basic authentication.
67299dbda23f7e5639814e88,Invalidates tokens for the given realm by sending a request to the invalidate tokens API.
67299dbda23f7e5639814e89,Returns the part number for the given position in the file.
67299dbda23f7e5639814e8a,Removes the given cache key from the cache.
67299dbda23f7e5639814e8b,Marks the transform as failed and logs the exception and failure message.
67299dbda23f7e5639814e8c,"Resolves the given expression as root attributes, using the given aliases to resolve any nested expressions."
67299dbda23f7e5639814e8d,Creates a field attribute for a keyword field with the given name.
67299dbda23f7e5639814e8e,Increments the translate metric.
67299dbda23f7e5639814e8f,Parses a date string into a ZonedDateTime with only the date component.
67299dbda23f7e5639814e90,Prints a message to the terminal with the specified verbosity level.
67299dbda23f7e5639814e91,Converts the IJK coordinates to latitude and longitude coordinates.
67299dbda23f7e5639814e92,Normalizes the ijk coordinates by finding the minimum value and subtracting it from all coordinates.
67299dbda23f7e5639814e93,Finds the neighboring cell in the given direction and updates the coordinates accordingly.
67299dbda23f7e5639814e94,Converts face coordinates to geo coordinates at the specified resolution.
67299dbda23f7e5639814e95,Convert an H3 address to the number of children at a given resolution.
67299dbda23f7e5639814e96,Converts an H3 address to the size of the smallest non-intersecting children.
67299dbda23f7e5639814e97,Returns the H3 index at the north pole for the given resolution.
67299dbda23f7e5639814e98,Returns the H3 index at the south polar region for a given resolution.
67299dbda23f7e5639814e99,Calculates the maximum latitude of the great circle defined by this point and the given point.
67299dbda23f7e5639814e9a,Returns the minimum latitude of the great circle defined by this point and the given point.
67299dbda23f7e5639814e9b,Converts a hex2d coordinate to a lat/lng coordinate.
67299dbda23f7e5639814e9c,Rotates the given H3 index 60 degrees counter-clockwise.
67299dbda23f7e5639814e9d,Consumes a point with the given coordinates and adds it to the simplified geometry.
67299dbda23f7e5639814e9e,Encodes a given string into a long value using the given length.
67299dbda23f7e5639814e9f,Encodes a pair of coordinates into a geohash string with a precision of 12 characters.
67299dbda23f7e5639814ea0,Encodes a geohash as a string.
67299dbda23f7e5639814ea1,Test loading resources from a parent classloader with a non-package name.
67299dbda23f7e5639814ea2,Checks the manifest of the jar for any issues.
67299dbda23f7e5639814ea3,Checks if the given array of doubles is in ascending order and throws an assertion error if not. Also checks the values associated with the keys.
67299dbda23f7e5639814ea4,Sorts the given array of key values and corresponding arrays of values in ascending order.
67299dbda23f7e5639814ea5,Compress the current data in the buffer.
67299dbda23f7e5639814ea6,Finds the agent jar file for APM.
67299dbda23f7e5639814ea7,Forcefully stops the JVM process associated with this server process.
67299dbda23f7e5639814ea8,Returns a list of all versions that are compatible with the current index version.
67299dbda23f7e5639814ea9,Asserts that the given number of tasks are unassigned in the cluster state.
67299dbda23f7e5639814eaa,Creates a PersistentTasksClusterService using the given function to generate assignments.
67299dbda23f7e5639814eab,"Returns an Optional containing the Error instance if the given Throwable or its cause chain contains an Error, otherwise returns an empty Optional."
67299dbda23f7e5639814eac,Collects all shard data paths from the given data paths.
67299dbda23f7e5639814ead,Initializes the routing table for a new index with the given metadata and unassigned info.
67299dbda23f7e5639814eae,Cancels the relocation of a shard and updates the assigned shards.
67299dbda23f7e5639814eaf,Resolves a set of index name expressions against the cluster state.
67299dbda23f7e5639814eb0,Checks if the given collection of aliases or indices represents all indices.
67299dbda23f7e5639814eb1,Close the bulk processor.
67299dbda23f7e5639814eb2,"Returns the list of task groups. If the groups have not been built yet, it will call the buildTaskGroups method to populate the list."
67299dbda23f7e5639814eb3,Scales down the given value by the sampling probability if the context is sampled.
67299dbda23f7e5639814eb4,Scales up a value if the context is sampled.
67299dbda23f7e5639814eb5,Encodes a hash value into a string representation of the ZXY coordinates.
67299dbda23f7e5639814eb6,Add an unbounded upper bound to the range aggregation.
67299dbda23f7e5639814eb7,Adds an unbounded range from the given key and from value.
67299dbda23f7e5639814eb8,"Returns a LeafBucketCollector for the given context and input collector, and updates the topChangedListener if necessary."
67299dbda23f7e5639814eb9,Submits a task to the cluster service with the result of the migration.
67299dbda23f7e5639814eba,Returns the value of the field at the given path as a byte array.
67299dbda23f7e5639814ebb,Returns the retention leases for this shard.
67299dbda23f7e5639814ebc,"Returns the retention leases for this shard, optionally refreshing them first."
67299dbda23f7e5639814ebd,Returns true if the given string has a length greater than 0.
67299dbda23f7e5639814ebe,Preserve the current thread context when executing the given command.
67299dbda23f7e5639814ebf,"Fast forwards the count down, returning true if the count down was successfully fast forwarded."
67299dbda23f7e5639814ec0,Simple pattern matching with optional case insensitivity.
67299dbda23f7e5639814ec1,Updates dynamic settings for a specific type.
67299dbda23f7e5639814ec2,Formats the given address using the default ports range.
67299dbda23f7e5639814ec3,Closes the given channel without throwing any exceptions.
67299dbda23f7e5639814ec4,Create a CompressedXContent object from a JSON string.
67299dbda23f7e5639814ec5,Calculates the maximum size of the encrypted output buffer required to wrap the given plaintext bytes. Assumes a max of one frame per component in a composite buffer.
67299dbda23f7e5639814ec6,Calculates the required size of the output buffer for the given plaintext bytes and number of buffers.
67299dbda23f7e5639814ec7,Converts a byte array to an IP address string.
67299dbda23f7e5639814ec8,Returns a new AsciiString that is a subsequence of this sequence.
67299dbda23f7e5639814ec9,Compares the specified string to this string and compares the specified range of characters to determine if they are the same . When ignoreCase is true the case of the characters is ignored during the comparison .
67299dbda23f7e5639814eca,"Returns the next positive power of two value that is greater than or equal to the specified value, or if the specified value is equal to or greater than 2^30, then 2^30."
67299dbda23f7e5639814ecb,"Returns a pseudorandom, uniformly distributed long value between least (inclusive) and bound (exclusive)."
67299dbda23f7e5639814ecc,Formats a message with a single argument using the specified message pattern.
67299dbda23f7e5639814ecd,Create a big-endian buffer that holds a sequence of the specified 32-bit integers.
67299dbda23f7e5639814ece,Calculates the checksum of the given data by calling the calculateChecksum function with the reader index and readable bytes of the data.
67299dbda23f7e5639814ecf,Write a unary value.
67299dbda23f7e5639814ed0,Finishes the encoding of this stream. Will fail if no data was written to this stream yet.
67299dbda23f7e5639814ed1,"Update the CRC with the specified value, repeating it the specified number of times."
67299dbda23f7e5639814ed2,Validates a valid header value.
67299dbda23f7e5639814ed3,Skips any white spaces in the given byte array starting at the specified index and returns the number of skipped bytes.
67299dbda23f7e5639814ed4,Checks if the secret store exists for the given secure config.
67299dbda23f7e5639814ed5,Checks if the current writer is stale based on the given flush interval.
67299dbda23f7e5639814ed6,Returns a collection of common input settings.
67299dbda23f7e5639814ed7,Parses the given expression and checks that the result is the same as the given expression .
67299dbda23f7e5639814ed8,"Checks the origin of the request against the allowed origins in the given configuration. Returns the origin if it is allowed, or null if not."
67299dbda23f7e5639814ed9,Encode the given source URI into an encoded String . The encoding is performed using the given encoding scheme .
67299dbda23f7e5639814eda,Decodes and cleans the given URI string. Removes any semicolon content and decodes the string using the given request's encoding. Also sanitizes the path by removing any path traversal sequences.
67299dbda23f7e5639814edb,"Return the fallback TimeZone, if any, for this RequestContext."
67299dbda23f7e5639814edc,Determine whether the given bean should be proxied with its target class rather than its interfaces .
67299dbda23f7e5639814edd,Set the argument names from the given string.
67299dbda23f7e5639814ede,Sets the main text content of the message.
67299dbda23f7e5639814edf,"Gets a connection from the underlying DataSource, using the specified user credentials if any. Sets the catalog and schema if specified."
67299dbda23f7e5639814ee0,Skip over any end-of-line characters.
67299dbda23f7e5639814ee1,"Connect to the STOMP server asynchronously, using the given handler to process the resulting session."
67299dbda23f7e5639814ee2,"Return the current TimeZone, taken from the current LocaleContext."
67299dbda23f7e5639814ee3,"This implementation supports programmatic lookup if the JTA UserTransaction,"
67299dbda23f7e5639814ee4,Checks for any leaked buffers and fails the test if any are found.
67299dbda23f7e5639814ee5,Increase the indentation level and refresh the indent writer.
67299dbda23f7e5639814ee6,Check whether the given array of enum constants contains a constant with the given name ignoring case when determining a match.
67299dbda23f7e5639814ee7,Checks whether the given line is a comment line and returns the index of the comment start or -1 if not a comment .
67299dbda23f7e5639814ee8,"Finds the best matching locale for the given language string. If the app supports the exact locale, it is returned. Otherwise, the best system locale is returned."
67299dbda23f7e5639814ee9,"Cancel the notification with the given notificationId. Uses conversation support if available, otherwise falls back to legacy method."
67299dbda23f7e5639814eea,Returns the angle in radians of the rotation around the y axis. Assumes the quaternion is normalized.
67299dbda23f7e5639814eeb,Returns the angle in radians of the rotation around the given axis.
67299dbda23f7e5639814eec,"Sets this matrix to a translation, rotation and scale matrix."
67299dbda23f7e5639814eed,Scales this matrix by the given vector.
67299dbda23f7e5639814eee,Returns the quality of a triangle with the given vertices. The quality is defined as the minimum squared length of the triangle's edges divided by the triangle's circumradius squared.
67299dbda23f7e5639814eef,Checks if two line segments intersect and returns the intersection point if they do.
67299dbda23f7e5639814ef0,Returns the angle in degrees of the vector from the y-axis to the specified point . Angles are towards the positive x-axis (typically counter-clockwise) and between 0 and 360 . The returned angle is the acute angle between the two vectors . It is always between 0 and 360 degrees .
