_id,Summary
67299dbda23f7e5639814ef1,Returns the angle in degrees of the vector from the y-axis to the specified point . Angles are towards the positive x-axis (typically counter-clockwise) and between 0 and 360 . The returned angle is the acute angle between the two vectors . It is always between 0 and 360 . In radians the return value is always between 0 and PI .
67299dbda23f7e5639814ef2,Cancels touch focus for all actors.
67299dbda23f7e5639814ef3,Sets whether debug lines for tables are shown for tables under the mouse . Only applicable if debug is enabled for the stage .
67299dbda23f7e5639814ef4,"Removes an actor from this group. If the actor is not a child of this group, nothing happens. If the actor is a group, all children are recursively removed. This method should be avoided in performance critical applications and might be removed in a future version."
67299dbda23f7e5639814ef5,Clears the group's children and optionally unfocuses them.
67299dbda23f7e5639814ef6,Sets the background of the container.
67299dbda23f7e5639814ef7,Clears the map and reduces the size of the backing arrays to be the specified capacity if they are larger.
67299dbda23f7e5639814ef8,Counts the number of runs in the given run and reverse the run if it is descending.
67299dbda23f7e5639814ef9,Schedules a task to be executed immediately.
67299dbda23f7e5639814efa,Scales the size of the particle emitter by the given scale factor.
67299dbda23f7e5639814efb,Rotates the particle controller by the given quaternion.
67299dbda23f7e5639814efc,Animate the given animation with the specified parameters and transition time.
67299dbda23f7e5639814efd,Queues an animation to be played after the current animation is finished.
67299dbda23f7e5639814efe,Returns a file object for the specified sub-directory within the application temp directory.
67299dbda23f7e5639814eff,Persist the given entity and return its id.
67299dbda23f7e5639814f00,Builds the JDBC URL for the given running service.
67299dbda23f7e5639814f01,Builds a JDBC URL for the given service and database.
67299dbda23f7e5639814f02,"Get the optional double value associated with a key, or NaN if there is no such key or if the value is not a number."
67299dbda23f7e5639814f03,"Get the optional int value associated with a key, or the default if there is no such key or if the value is not a number."
67299dbda23f7e5639814f04,"Get an optional long value associated with a key, or the default if there is no such key or if the value is not a long."
67299dbda23f7e5639814f05,"Returns the string value associated with the given name, or an empty string if there is no such key."
67299dbda23f7e5639814f06,"Creates a new directory with the given name and owner, with default permissions of 0755."
67299dbda23f7e5639814f07,"Creates a file with the given name, owner and content."
67299dbda23f7e5639814f08,Stops the overlord by gracefully stopping the leader lifecycle and unregistering the leader selector listener.
67299dbda23f7e5639814f09,Converts Druid table function parameters to Calcite function parameters.
67299dbda23f7e5639814f0a,"Checks if the given RexNode is a non-trivial string concatenation, meaning it is a concatenation of multiple strings and not just a single string literal."
67299dbda23f7e5639814f0b,"Submits a SQL task successfully with the given query, username, and password."
67299dbda23f7e5639814f0c,Returns the smallest power of two that is greater than or equal to the given value.
67299dbda23f7e5639814f0d,Hashes a single value using the specified hash function.
67299dbda23f7e5639814f0e,Hashes a single value and converts it to an integer.
67299dbda23f7e5639814f0f,Opens all NeoStores using the default store types.
67299dbda23f7e5639814f10,Decodes a PropertyBlock into a TextValue .
67299dbda23f7e5639814f11,Sets the end condition for the race to be a combination of the given end conditions.
67299dbda23f7e5639814f12,"Returns a valid code point between the minimum code point and the given maximum code point, excluding unassigned, private use, and surrogate code points."
67299dbda23f7e5639814f13,Unlocks the exclusive lock and takes the write lock for the given address.
67299dbda23f7e5639814f14,Get the reference count of the paged file.
67299dbda23f7e5639814f15,Evicts a page from the cache and updates the translation table accordingly.
67299dbda23f7e5639814f16,Clears the changed chunks in the chunkChangedArray for the given denseNodes.
67299dbda23f7e5639814f17,Creates a log channel for an existing version of the physical log.
67299dbda23f7e5639814f18,Returns the total waiting time in nanoseconds for this transaction.
67299dbda23f7e5639814f19,Stops the index population and checks if it is empty.
67299dbda23f7e5639814f1a,Returns a channel for reading the log file.
67299dbda23f7e5639814f1b,Release the write lock.
67299dbda23f7e5639814f1c,Checks if the cursor is out of bounds and if the seeker is closed.
67299dbda23f7e5639814f1d,"Write the generation and pointer to the given cursor, asserting that they are valid values."
67299dbda23f7e5639814f1e,"Bumps the unstable generation of this tree, keeping the stable generation unchanged."
67299dbda23f7e5639814f1f,Normalize this duration value to a standard representation .
67299dbda23f7e5639814f20,Parses the command line arguments and returns a CliArgs object containing the parsed arguments. Throws an ArgumentParserException if there is an error in parsing the arguments.
67299dbda23f7e5639814f21,Prints the given text only if the format is set to plain.
67299dbda23f7e5639814f22,Checks if the current character is inside a quote
67299dbda23f7e5639814f23,Decrease the key of the given node to the new key.
67299dbda23f7e5639814f24,Remove x from the child list of y and add it to the root list.
67299dbda23f7e5639814f25,"Releases the latch, allowing any waiting threads to proceed."
67299dbda23f7e5639814f26,Applies the given work unit to the stack and executes it until it is completed.
67299dbda23f7e5639814f27,Returns a user-friendly string representation of the store version.
67299dbda23f7e5639814f28,"Returns the total degree of this node, i.e. the sum of all its degrees for all types."
67299dbda23f7e5639814f29,Disables the given commands by setting their probability factor to 0.
67299dbda23f7e5639814f2a,Runs the test with the given iteration timeout and time unit.
67299dbda23f7e5639814f2b,"Runs the test for a specified number of iterations, with a timeout for each iteration. If an exception is thrown, it will print out the details of the previous run before re-throwing the exception."
67299dbda23f7e5639814f2c,Creates indexes for the given graph database service.
67299dbda23f7e5639814f2d,Deletes all relationships and nodes in the given database using batched delete.
67299dbda23f7e5639814f2e,Negotiates the protocol version with the given connection by sending the current protocol version and asserting that the connection negotiates it.
67299dbda23f7e5639814f2f,"Read a primitive value from the buffer, with a given limit on the number of bytes that can be read."
67299dbda23f7e5639814f30,Returns the center point for the given derived value and level.
67299dbda23f7e5639814f31,Returns a list of tiles that intersect the given envelope.
67299dbda23f7e5639814f32,Returns the double coordinates for the given normalized coordinates and level.
67299dbda23f7e5639814f33,Propagate the length from source to target.
67299dbda23f7e5639814f34,Inserts the given element into the heap . Returns true if the element was successfully inserted .
67299dbda23f7e5639814f35,Sorts the heap using heap sort algorithm.
67299dbda23f7e5639814f36,Heapify the heap by sifting down all elements starting from the middle of the heap.
67299dbda23f7e5639814f37,Sifts down the element at the given index .
67299dbda23f7e5639814f38,"Sets bits in the given array of longs, starting at the given bit index, using the given number of slots, starting at the given slot index."
67299dbda23f7e5639814f39,"Returns a subpath of the current path, starting at the specified beginIndex and ending at the specified endIndex. If the original path has a trailing separator or has more elements than the endIndex, the subpath will have a trailing separator. Otherwise, the subpath will not have a trailing separator."
67299dbda23f7e5639814f3a,"Perform a file operation on a list of database files, with the option to include the id file and specify an existing target strategy."
67299dbda23f7e5639814f3b,Returns the symmetric difference between two sorted sets of integers.
67299dbda23f7e5639814f3c,Count the number of unique elements in two sorted arrays.
67299dbda23f7e5639814f3d,Compares two iterators for equality.
67299dbda23f7e5639814f3e,Counts the number of elements in the iterator that satisfy the given predicate.
67299dbda23f7e5639814f3f,Add a lazy binding for the given component supplier and type to the list of lazy bindings.
67299dbda23f7e5639814f40,"Returns a channel for reading a log file, given a file system abstraction, a path to the log file, and the kernel version."
67299dbda23f7e5639814f41,"Returns an iterator over the values in the index, sorted by relevance for the given field."
67299dbda23f7e5639814f42,"Ensure that the current DocIdSetIterator is valid, and if not, try to advance to the next one."
67299dbda23f7e5639814f43,"Add a document to the index, if the document is not null."
67299dbda23f7e5639814f44,Updates or deletes a document in the index based on the given term.
67299dbda23f7e5639814f45,Clears the URL cache for this class loader.
67299dbda23f7e5639814f46,Asserts that the given RequestBuilder throws an exception of the specified type and status when executed.
67299dbda23f7e5639814f47,"Retrieve a column value from a ResultSet, using the specified value type."
67299dbda23f7e5639814f48,Configures modules to be registered with the Jackson ObjectMapper.
67299dbda23f7e5639814f49,"Returns the child element with the specified name, or null if it doesn't exist."
67299dbda23f7e5639814f4a,Tests for illegal order input.
67299dbda23f7e5639814f4b,Determine a match between the given method name and the mapped name.
67299dbda23f7e5639814f4c,Tests the network host setting for GCE discovery when the provided GCE metadata server does not exist .
67299dbda23f7e5639814f4d,Handles the resize event of the widget collection and checks the size of the widgets.
67299dbda23f7e5639814f4e,"Creates a default field type for the given field name, with subfields for min and max metrics."
67299dbda23f7e5639814f4f,"Sets the x coordinate of the center of this sprite, adjusting the x coordinate of the sprite to keep the center at the same position."
67299dbda23f7e5639814f50,Creates an ElasticsearchSecurityException with a message indicating that the token has expired and adds the appropriate header for WWW-Authenticate.
67299dbda23f7e5639814f51,"Registers a test task for the given project and source set, using the source set name as the task name."
67299dbda23f7e5639814f52,Returns true if the element at the given index is indexed.
67299dbda23f7e5639814f53,Returns the field data for the given field type and field data context.
67299dbda23f7e5639814f54,"Computes the sum of the values in the given array, ignoring any NaN values."
67299dbda23f7e5639814f55,Searches for a single entry in the LDAP server using the given parameters and returns the result to the listener. Supports both LDAPConnection and LDAPConnectionPool implementations.
67299dbda23f7e5639814f56,"Attempts to delete the given path, throwing an unchecked exception if it fails."
67299dbda23f7e5639814f57,"Writes the specified InputStream to this file, optionally appending it to existing data."
67299dbda23f7e5639814f58,Computes the limit of bytes for auto mode.
67299dbda23f7e5639814f59,Determine whether the given expression is a valid cron expression.
67299dbda23f7e5639814f5a,"Returns the database ID for the given database name, if it exists."
67299dbda23f7e5639814f5b,Checks if there is enough capacity in the byte buffer to encode the specified number of values.
67299dbda23f7e5639814f5c,Compare two data tiers based on their position in the ordered list of tiers.
67299dbda23f7e5639814f5d,Parse a float value from the given XContentParser.
67299dbda23f7e5639814f5e,Wraps a PathExpander with a printing PathExpander that prints the paths it expands.
67299dbda23f7e5639814f5f,Removes the key from this set if it is present. Returns true if the set contained the key.
67299dbda23f7e5639814f60,Returns the value of the designated column in the current row of this SqlRowSet as a double.
67299dbda23f7e5639814f61,Release the shared lock if the final state is reached.
67299dbda23f7e5639814f62,Get the exceptions declared by the given method .
67299dbda23f7e5639814f63,Creates a new CoordinatesBuilder with the given longitude and latitude.
67299dbda23f7e5639814f64,Loads the application context for AOT processing.
67299dbda23f7e5639814f65,Set the name of the misfire instruction.
67299dbda23f7e5639814f66,This function takes in a transaction and an iterable of tokens and returns an array of ids corresponding to the tokens in the transaction.
67299dbda23f7e5639814f67,Determine if the given element is annotated with any meta-annotation of the given annotation type.
67299dbda23f7e5639814f68,Create a new PersistenceManagedTypes instance from the given managed class names.
67299dbda23f7e5639814f69,Returns the string representation of the URI builder.
67299dbda23f7e5639814f6a,Waits for the cluster state to match the given predicate.
67299dbda23f7e5639814f6b,Returns the number of positions in the block.
67299dbda23f7e5639814f6c,Convert a comma-delimited string to a set. Note that this will preserve the order of the elements in the original string.
67299dbda23f7e5639814f6d,Stop watching the given thread and task for death events.
67299dbda23f7e5639814f6e,"Sets the field value in the given document, either by updating the existing value or creating a new field."
67299dbda23f7e5639814f6f,Translate the given SQLException into a generic DataAccessException .
67299dbda23f7e5639814f70,Return the list of configured HttpMessageConverters .
67299dbda23f7e5639814f71,Calculates an exponential backoff time with jitter.
67299dbda23f7e5639814f72,Converts the given word to lower case using the SWAR algorithm.
67299dbda23f7e5639814f73,Returns the smallest power of two that is greater than or equal to the given value .
67299dbda23f7e5639814f74,"Adds a new request to the bulk request with the given data, starting from the specified index and with the specified content type."
67299dbda23f7e5639814f75,Sets the timeout for this search request.
67299dbda23f7e5639814f76,Log an error with the given message and throwable.
67299dbda23f7e5639814f77,Adds an unbounded upper bound to the range aggregation.
67299dbda23f7e5639814f78,Returns the value of the designated column in the current row of this SqlRowSet as an int.
67299dbda23f7e5639814f79,Set the type of the scope annotation to be used .
67299dbda23f7e5639814f7a,Returns the maximum number of indices this buffer can hold.
67299dbda23f7e5639814f7b,Trigger {@code beforeCommit} callbacks on all currently registered synchronizations.
67299dbda23f7e5639814f7c,"Transforms the given constraints to only include partition keys, if any."
67299dbda23f7e5639814f7d,Handles any error that occurs during the WebSocket session . This method will close the session and cancel any ongoing processing .
67299dbda23f7e5639814f7e,"Determine whether the given property descriptor has a unique write method, i.e. whether the type of the property is a subtype of the type of the write method's parameter."
67299dbda23f7e5639814f7f,Checks if the queue size is below a certain threshold and starts a background fetch if it is.
67299dbda23f7e5639814f80,Creates a new SslHandler with the given allocator and delegated task executor.
67299dbda23f7e5639814f81,Flushes the base64 buffer to the output stream.
67299dbda23f7e5639814f82,"Returns the element type of an array type, or null if the given type is not an array."
67299dbda23f7e5639814f83,Cancels the population of each index in the list.
67299dbda23f7e5639814f84,Increases the actor's size by the specified amount in each direction.
67299dbda23f7e5639814f85,"Returns the value associated with the specified key, or the specified default value if the key is not present in the map."
67299dbda23f7e5639814f86,"Returns the key for the specified value, or {@code notFound} if it can't be found."
67299dbda23f7e5639814f87,Process the field value through the RequestDataValueProcessor.
67299dbda23f7e5639814f88,Set the comment prefix to use for lines that should be ignored.
67299dbda23f7e5639814f89,Ensures that the file is open and throws an exception if it is not.
