67299dbda23f7e5639814ebe,"Preserves the execution context of the given Runnable command, returning a context-preserving Runnable instance if necessary."
67299dbda23f7e5639814ebf,"Resets the countdown to zero and checks if the previous count was valid."
67299dbda23f7e5639814ec0,"Checks if a given string matches a specified pattern, with optional case insensitivity. The pattern may include wildcard characters ('*') that can match any sequence of characters."
67299dbda23f7e5639814ec1,"Updates the target settings with the specified dynamic settings, applying changes only to settings that are dynamically updateable."
67299dbda23f7e5639814ec2,"Formats the given `InetAddress` using a default `PortsRange`."
67299dbda23f7e5639814ec3,"Closes the given channel."
67299dbda23f7e5639814ec4,"Converts a JSON string into a `CompressedXContent` object by parsing the JSON content and copying its structure."
67299dbda23f7e5639814ec5,"Calculates the output network buffer size required to accommodate the given number of plaintext bytes and buffers, considering the maximum overhead per buffer."
67299dbda23f7e5639814ec6,"Calculates the required buffer space for encrypted output based on the given plaintext size and number of buffers."
67299dbda23f7e5639814ec7,"Converts a byte array to an IP address string representation, supporting both IPv4 and IPv6 formats."
67299dbda23f7e5639814ec8,"Returns a subsequence of the current `AsciiString` from the specified `start` index to the specified `end` index.
67299dbda23f7e5639814ec9,"Compares a region of this sequence with a region of the specified string for equality, optionally ignoring case differences."
67299dbda23f7e5639814eca,"Calculates the next power of two greater than or equal to the specified value, ensuring the result is within the range of valid positive integers."
67299dbda23f7e5639814ecb,"Generates a random `long` value within the specified range `[least, bound)`."
67299dbda23f7e5639814ecc,"Formats a message string using a single argument, returning a `FormattingTuple` containing the formatted message and any throwable if present."
67299dbda23f7e5639814ecd,"Copies the given integer values into a new ByteBuf instance, writing each integer in sequence."
67299dbda23f7e5639814ece,"Calculates the checksum of the given `ByteBuf` data using the CRC32C algorithm."
67299dbda23f7e5639814ecf,"Writes the specified non-negative integer value in unary format to the given ByteBuf."
67299dbda23f7e5639814ed0,"Finishes the encoding process by writing the end-of-stream markers and flushing any remaining data to the channel."
67299dbda23f7e5639814ed1,"Updates the CRC value by repeatedly applying the specified value a given number of times."
67299dbda23f7e5639814ed2,"Validates a given header value against the field-content rule as defined in RFC 7230, returning the index of the first invalid character or -1 if the value is valid."
67299dbda23f7e5639814ed3,"Skips leading whitespace characters in a byte array starting from a given index."
67299dbda23f7e5639814ed4,"Checks if a secret store exists for the given `SecureConfig` configuration."
67299dbda23f7e5639814ed5,"Checks if the current writer is considered stale based on the specified flush interval."
67299dbda23f7e5639814ed6,"Combines a given collection of plugin configuration specifications with a set of common input settings, ensuring no duplicates."
67299dbda23f7e5639814ed7,"Parses the given expression and verifies that its string representation of the AST matches the expected format."
67299dbda23f7e5639814ed8,"Checks the given request origin against the configured CORS settings and returns the allowed origin if it matches, or null if it does not."
67299dbda23f7e5639814ed9,"Encodes the given source string using the specified charset and URI type."
67299dbda23f7e5639814eda,"Decodes the given URI string from the request, removes semicolon content, and sanitizes the path by collapsing multiple slashes into a single slash."
67299dbda23f7e5639814edb,"Returns the fallback time zone if JSTL is present and a valid time zone is available from the JSTL configuration; otherwise, returns null."
67299dbda23f7e5639814edc,"Determines whether the target class should be proxied for the given bean class and bean name."
67299dbda23f7e5639814edd,"Sets the argument names by parsing a comma-delimited string and validates each name as a valid Java identifier."
67299dbda23f7e5639814ede,"Sets the text content of the message as plain text."
67299dbda23f7e5639814edf,"Returns a database connection using thread-bound credentials if available, otherwise defaults to configured credentials, and sets the specified catalog and schema if provided."
67299dbda23f7e5639814ee0,"Skips over end-of-line characters in the provided ByteBuffer, handling both '\n' and '\r\n' sequences."
67299dbda23f7e5639814ee1,"Connects asynchronously to a STOMP session using the provided STOMP session handler."
67299dbda23f7e5639814ee2,"Retrieves the current time zone based on the locale context."
67299dbda23f7e5639814ee3,"Retrieves the current JTA transaction object, ensuring a UserTransaction is available and handling its lookup if necessary."
67299dbda23f7e5639814ee4,"Checks for memory leaks by verifying that all created data buffers have been deallocated."
67299dbda23f7e5639814ee5,"Increases the indentation level and updates the current indent."
67299dbda23f7e5639814ee6,"Checks if the specified constant is present in the given array of enum values, performing a case-insensitive comparison."
67299dbda23f7e5639814ee7,"Determines the starting index of a comment in the given line using the START_COMMENT token."
67299dbda23f7e5639814ee8,"Finds the best matching locale for a given language string, returning the exact locale if supported by the app, or a suitable system locale otherwise."
67299dbda23f7e5639814ee9,"Cancels a notification with the specified ID, utilizing conversation support if available, and falls back to legacy cancellation otherwise."
67299dbda23f7e5639814eea,"Calculates the yaw angle in radians from the quaternion, taking into account potential gimbal lock conditions."
67299dbda23f7e5639814eeb,"Calculates the angle in radians around the specified axis vector."
67299dbda23f7e5639814eec,"Sets this affine transformation to a translation, rotation, and scaling defined by the given vectors and angle in degrees."
67299dbda23f7e5639814eed,"Scales the current transformation matrix by the given vector components."
67299dbda23f7e5639814eee,"Calculates the quality of a triangle defined by three points in a 2D plane."
67299dbda23f7e5639814eef,"Determines if two line segments intersect and optionally computes the intersection point."
67299dbda23f7e5639814ef0,"Calculates the angle in degrees between the positive x-axis and the point (x, y) using the four-quadrant inverse tangent function."
67299dbda23f7e5639814ef1,"Calculates the angle in degrees between the positive x-axis and the point (x, y) in a 360-degree circle, handling edge cases such as infinite and NaN values."
67299dbda23f7e5639814ef2,"Cancels all current touch focuses."
67299dbda23f7e5639814ef3,"Sets the debug mode for the table under the mouse cursor, enabling all debug options if the parameter is true, or disabling them if false."
67299dbda23f7e5639814ef4,"Removes the specified actor from the group, optionally unfocusing it."
67299dbda23f7e5639814ef5,"Clears the current object and optionally unfocuses all child actors."
67299dbda23f7e5639814ef6,"Sets the background drawable for the component, optionally adjusting the padding."
67299dbda23f7e5639814ef7,"Clears the map and resizes the backing array to accommodate the specified maximum capacity, ensuring efficient memory usage based on the load factor."
67299dbda23f7e5639814ef8,"Counts the length of a run in the specified array and ensures the run is in ascending order by reversing it if necessary."
67299dbda23f7e5639814ef9,"Posts a task for immediate execution without any delay or repetition."
67299dbda23f7e5639814efa,"Scales the size of an object uniformly by the specified factor."
67299dbda23f7e5639814efb,"Rotates the current transformation by the specified quaternion rotation."
67299dbda23f7e5639814efc,"Animates the specified animation with the given parameters, applying a transition if specified."
67299dbda23f7e5639814efd,"Queues an animation for playback with specified parameters, handling transitions and looping behavior."
67299dbda23f7e5639814efe,"Retrieves a directory as a File object by resolving the specified sub-directory path and creating the directory if it does not exist."
67299dbda23f7e5639814eff,"Persists the given entity and returns its identifier."
67299dbda23f7e5639814f00,"Constructs a URL for the given RunningService instance."
67299dbda23f7e5639814f01,"Constructs a JDBC URL for the specified running service and optional database name."
67299dbda23f7e5639814f02,"Returns the double value associated with the specified name, or NaN if no such value exists."
67299dbda23f7e5639814f03,"Returns the value mapped by the specified name as an int, or 0 if no such mapping exists."
67299dbda23f7e5639814f04,"Returns the value mapped by the specified name as a long, or 0 if no such mapping exists or if the value is not a valid long."
67299dbda23f7e5639814f05,"Returns the string value associated with the specified name, or an empty string if no such value exists."
67299dbda23f7e5639814f06,"Creates a directory entry with the specified name and owner, using a default mode of 0755."
67299dbda23f7e5639814f07,"Creates a file entry with the specified name, owner, and content, using a default file mode."
67299dbda23f7e5639814f08,"Stops the leader lifecycle gracefully and unregisters the listener while ensuring thread safety."
67299dbda23f7e5639814f09,"Converts the parameters of a given TableFunction into a list of FunctionParameter objects suitable for use with Calcite."
67299dbda23f7e5639814f0a,"Determines if the given `RexNode` represents a non-trivial string concatenation operation, meaning it is a string concatenation and involves at least one input reference."
67299dbda23f7e5639814f0b,"Submits an MSQ task with the expectation that it will be accepted, returning the task status upon successful submission."
67299dbda23f7e5639814f0c,"Calculates the smallest power of two that is greater than or equal to the specified positive long value."
67299dbda23f7e5639814f0d,"Calculates the hash of a single long value using a sequence of initialization, update, and finalization steps."
67299dbda23f7e5639814f0e,"Computes an integer hash code for a given long value."
67299dbda23f7e5639814f0f,"Opens all NeoStores by delegating to the `openNeoStores` method with the default store types."
67299dbda23f7e5639814f10,"Decodes a `PropertyBlock` into a `TextValue` by extracting and processing its value blocks."
67299dbda23f7e5639814f11,"Adds one or more end conditions to the race, merging them with any existing conditions."
67299dbda23f7e5639814f12,"Determines the next valid Unicode code point that is not unassigned, private use, or a surrogate, within the specified maximum code point limit."
67299dbda23f7e5639814f13,"Unlocks an exclusive lock and transitions to a write lock state for the given address."
67299dbda23f7e5639814f14,"Retrieves the reference count from the header state."
67299dbda23f7e5639814f15,"Evicts a page from the translation table by updating its mapping and handling versioning if necessary."
67299dbda23f7e5639814f16,"Clears the change status of chunks based on the specified node density."
67299dbda23f7e5639814f17,"Creates a log channel for an existing log version by allocating the corresponding file, reading its header, and positioning the channel at the start of the log data."
67299dbda23f7e5639814f18,"Calculates the total waiting time in nanoseconds for a transaction, including any ongoing query execution time."
67299dbda23f7e5639814f19,"Stops the given index population and ensures that any ongoing store scan is halted if no populations remain."
67299dbda23f7e5639814f1a,"Returns a `PhysicalLogVersionedStoreChannel` for the file at index 0, handling potential I/O exceptions."
67299dbda23f7e5639814f1b,"Releases the write lock by transforming the current state using a spin-wait loop until the transformation is successful."
67299dbda23f7e5639814f1c,"Checks if the cursor is out of bounds and verifies that the seeker is not closed when an out-of-bounds condition is detected."
67299dbda23f7e5639814f1d,"Writes the specified generation and pointer to the given PageCursor after validating their boundaries."
67299dbda23f7e5639814f1e,"Increments the unstable generation component of the current generation value."
67299dbda23f7e5639814f1f,"Normalizes the duration by adjusting the days, seconds, and nanoseconds to ensure that nanoseconds are less than a second and seconds are less than a day."
67299dbda23f7e5639814f20,"Parses command-line arguments and returns a populated `CliArgs` object, throwing an `ArgumentParserException` if any validation or parsing errors occur."
67299dbda23f7e5639814f21,"Prints the specified text if the current format is plain."
67299dbda23f7e5639814f22,"Determines if the given string is not null and not a comment delimiter."
67299dbda23f7e5639814f23,"Decreases the key value of a specified node in the Fibonacci heap, ensuring the heap property is maintained. If the new key is greater than the current key, an exception is thrown. The method may trigger a cut and cascading cuts to maintain the heap structure, and updates the minimum node if necessary."
67299dbda23f7e5639814f24,"Cuts the node `x` from its parent `y` and adds `x` to the root list of the Fibonacci heap."
67299dbda23f7e5639814f25,"Releases all waiting threads by atomically swapping the release sentinel onto the stack, ensuring that any waiters are unparked if present."
67299dbda23f7e5639814f26,"Applies the given work unit by scheduling it on the stack and executing it while handling any potential execution failures."
67299dbda23f7e5639814f27,"Returns a formatted string representing the version of the store, combining the storage engine name, format family name, and version numbers."
67299dbda23f7e5639814f28,"Calculates the total degree by summing the degrees of all types in both directions."
67299dbda23f7e5639814f29,"Disables the specified commands by setting their probability factors to zero."
67299dbda23f7e5639814f2a,"Runs the test code with a specified iteration timeout and time unit, potentially throwing an exception if an error occurs during execution."
67299dbda23f7e5639814f2b,"Runs a series of iterations with a specified timeout for each, handling any exceptions by logging details of the previous run."
67299dbda23f7e5639814f2c,"Creates various indexes in the provided graph database service, including token, node property, and relationship property indexes, within a transactional context."
67299dbda23f7e5639814f2d,"Deletes all relationships and nodes from the provided `GraphDatabaseService` instance in batches to manage transaction size and resource usage efficiently."
67299dbda23f7e5639814f2e,"Negotiates the protocol version with the given transport connection, ensuring that the expected protocol version is agreed upon."
67299dbda23f7e5639814f2f,"Reads a primitive value from the input stream up to the specified limit, determining the type of the value to read using the current marker."
67299dbda23f7e5639814f30,"Calculates the center point coordinates for a given derived value and level."
67299dbda23f7e5639814f31,"Returns a list of tile ranges that intersect with the specified envelope."
67299dbda23f7e5639814f32,"Calculates and returns the double precision coordinates for a given set of normalized coordinates at a specified level, ensuring that each coordinate is clamped within its defined range."
67299dbda23f7e5639814f33,"Propagates the length from the source node to the target node, updating the internal state and scheduling further processing if necessary."
67299dbda23f7e5639814f34,"Inserts an element into the heap, growing the heap if necessary and maintaining the heap property."
67299dbda23f7e5639814f35,"Sorts the elements in the heap using the heap sort algorithm."
67299dbda23f7e5639814f36,"Heapifies the entire heap to maintain the heap property by sifting down elements from the middle of the heap to the root."
67299dbda23f7e5639814f37,"Initiates the sift-down operation for the specified element within the heap."
67299dbda23f7e5639814f38,"Sets a sequence of bits in a specified range within a long array to 1, starting from a given position and spanning a specified number of slots."
67299dbda23f7e5639814f39,"Returns a subpath of the current path from the specified begin index, inclusive, to the specified end index, exclusive. If the original path has a trailing separator or if the number of elements is greater than the end index, the resulting subpath will also have a trailing separator."
67299dbda23f7e5639814f3a,"Performs a specified file operation on a set of database files, potentially including ID files, while handling existing target strategies and optionally skipping non-existent files."
67299dbda23f7e5639814f3b,"Calculates the symmetric difference between two sorted integer arrays, returning a new array containing elements that are present in either of the input arrays but not in both."
67299dbda23f7e5639814f3c,"Computes a packed long value representing the count of unique elements in two sorted arrays."
67299dbda23f7e5639814f3d,"Determines if two iterators are equal by comparing their elements sequentially and ensuring both have the same number of elements."
67299dbda23f7e5639814f3e,"Counts the number of elements in the provided iterator."
67299dbda23f7e5639814f3f,"Adds a lazy binding to the collection, ensuring the binding and type are not null and that the binder has not been configured yet."
67299dbda23f7e5639814f40,"Opens a read channel for a log file at the specified path, ensuring compatibility with the given kernel version."
67299dbda23f7e5639814f41,"Retrieves an iterator over values sorted by relevance for a specified field."
67299dbda23f7e5639814f42,"Ensures that the current document ID iterator is valid by advancing through matching documents until a non-null iterator is found, or returns false if no such iterator exists."
67299dbda23f7e5639814f43,"Adds a document to the writer if the document is not null."
67299dbda23f7e5639814f44,"Updates the specified document if it is not null; otherwise, deletes documents matching the given term."
67299dbda23f7e5639814f45,"Clears the cache for all URLs if the current instance is not exploded."
67299dbda23f7e5639814f46,"Asserts that executing a given `RequestBuilder` throws an exception of the specified type and matches the expected `RestStatus`."
67299dbda23f7e5639814f47,"Retrieves the value of the specified column from the given `ResultSet` using the provided column index and expected parameter type."
67299dbda23f7e5639814f48,"Sets the modules for the Jackson2ObjectMapperBuilder using a Consumer to modify the list of modules."
67299dbda23f7e5639814f49,"Retrieves the first child element with the specified name from the list of children, or returns null if no such child exists."
67299dbda23f7e5639814f4a,"Tests that a `NullPointerException` is thrown when attempting to set a null sort order in `ScoreSortBuilder`, and verifies that the exception message is ""sort order cannot be null."""
67299dbda23f7e5639814f4b,"Determines if the given method name matches the specified mapped name pattern using simple wildcard matching."
67299dbda23f7e5639814f4c,"Tests the behavior of the network host resolution when provided with an incorrect GCE network setting."
67299dbda23f7e5639814f4d,"Handles the resize event by checking and updating the size of all registered resizable widgets, ensuring they are attached and have valid dimensions before invoking their resize logic."
67299dbda23f7e5639814f4e,"Creates a default `AggregateDoubleMetricFieldType` for the specified field name, initializing it with subfields for minimum and maximum metrics, and setting the default metric to minimum."
67299dbda23f7e5639814f4f,"Sets the x-coordinate of the center of the object by adjusting the x-position based on the specified width."
67299dbda23f7e5639814f50,"Creates an `ElasticsearchSecurityException` indicating that a token has expired, with an HTTP status of unauthorized and an appropriate authentication header."
67299dbda23f7e5639814f51,"Registers a RestIntegTestTask for the specified SourceSet within the given Project."
67299dbda23f7e5639814f52,"Determines if the element at the specified index is indexed."
67299dbda23f7e5639814f53,"Retrieves the index field data for a given mapped field type and field data context, utilizing a field data builder to construct the necessary data structure."
67299dbda23f7e5639814f54,"Calculates the sum of the elements in the given array, treating NaN values as zero."
67299dbda23f7e5639814f55,"Searches for an LDAP entry using the provided parameters and notifies the listener with the search result entry."
67299dbda23f7e5639814f56,"Deletes a file or directory at the specified path, retrying the operation if necessary, and throws unchecked exceptions if an error occurs."
67299dbda23f7e5639814f57,"Writes data from the given InputStream to a file, with an option to append to the existing content."
67299dbda23f7e5639814f58,"Calculates the memory limit in bytes for subquery result inlining per query, based on the available JVM memory after accounting for lookup footprints and the maximum number of concurrent queries."
67299dbda23f7e5639814f59,"Determines if the given expression is valid by attempting to parse it."
67299dbda23f7e5639814f5a,"Retrieves an Optional containing a NamedDatabaseId by its database name."
67299dbda23f7e5639814f5b,"Checks if there is sufficient capacity to accommodate the specified number of additional integers."
67299dbda23f7e5639814f5c,"Compares two tier strings and returns an integer indicating their order based on a predefined list of tiers."
67299dbda23f7e5639814f5d,"Parses the current token from the provided XContentParser as a float value, ensuring the token is of the expected numeric type."
67299dbda23f7e5639814f5e,"Returns a PathExpander that wraps the given source PathExpander and applies a predicate to determine whether to print path details using a default path descriptor."
67299dbda23f7e5639814f5f,"Removes the specified key from the collection, if it is present, and returns true if the key was successfully removed."
67299dbda23f7e5639814f60,"Retrieves the value of the designated column in the current row of this `ResultSet` object as a `double`."
67299dbda23f7e5639814f61,"Sets the final state and always returns true, indicating that the shared lock has been released."
67299dbda23f7e5639814f62,"Retrieves a list of exception types from the method signature, throwing an IllegalStateException if no exception types are found."
67299dbda23f7e5639814f63,"Adds a new coordinate with the specified longitude and latitude to the CoordinatesBuilder, ensuring dimensional consistency with existing coordinates."
67299dbda23f7e5639814f64,"Loads the application context for AOT (Ahead-Of-Time) processing based on the provided merged context configuration."
67299dbda23f7e5639814f65,"Sets the misfire instruction using the specified constant name, ensuring the name is not null or blank and corresponds to a valid misfire instruction constant."
67299dbda23f7e5639814f66,"Retrieves an array of IDs for the given tokens using the specified transaction."
67299dbda23f7e5639814f67,"Determines if the specified annotated element has any meta-annotations of the given annotation type."
67299dbda23f7e5639814f68,"Creates a new instance of `PersistenceManagedTypes` with the specified managed class names."
67299dbda23f7e5639814f69,"Returns a string representation of the URI being built."
67299dbda23f7e5639814f6a,"Waits for the cluster state to satisfy a given predicate, notifying the listener when the desired state is reached or a timeout occurs."
67299dbda23f7e5639814f6b,"Returns the number of positions in the block."
67299dbda23f7e5639814f6c,"Converts a comma-delimited string into a set of strings, preserving the order of elements."
67299dbda23f7e5639814f6d,"Removes the specified task from being watched on the given thread."
67299dbda23f7e5639814f6e,"Sets the value of a specified field in the given `IngestDocument` by updating the source map if the field exists, or by using the document's `setFieldValue` method if it does not."
67299dbda23f7e5639814f6f,"Translates a given `SQLException` into a `DataAccessException`, using a configured `SQLExceptionTranslator`, or defaults to an `UncategorizedSQLException` if no specific translation is available."
67299dbda23f7e5639814f70,"Returns a list of configured `HttpMessageConverter` instances, initializing the list if necessary by configuring, adding default, and extending the converters."
67299dbda23f7e5639814f71,"Calculates an exponential backoff time with jitter, based on the number of past attempts, ensuring the backoff does not exceed a specified maximum."
67299dbda23f7e5639814f72,"Converts the given word to lowercase by applying a bitmask derived from an uppercase pattern."
67299dbda23f7e5639814f73,"Calculates the smallest power of two that is greater than or equal to the specified positive integer value."
67299dbda23f7e5639814f74,"Adds a portion of the given byte array to the bulk request with the specified content type."
67299dbda23f7e5639814f75,"Sets the timeout for the search request."
67299dbda23f7e5639814f76,"Logs an error message with an associated throwable cause if error logging is enabled."
67299dbda23f7e5639814f77,"Adds a range with an unbounded lower limit and a specified upper limit to the aggregation."
