67299dbda23f7e5639814f78,"Retrieves the value of the designated column in the current row of this `ResultSet` object as an `int`.
67299dbda23f7e5639814f79,"Sets the scope annotation type for this instance, ensuring that the provided class is not null."
67299dbda23f7e5639814f7a,"Returns the capacity of the buffer, which represents the maximum number of indices."
67299dbda23f7e5639814f7b,"Triggers the `beforeCommit` callback on all registered `TransactionSynchronization` instances, indicating whether the transaction is read-only."
67299dbda23f7e5639814f7c,"Transforms the given constraints by retaining only the partition key columns."
67299dbda23f7e5639814f7d,"Handles an error by emitting an empty signal, notifying the receive publisher, and canceling the send processor if it exists, propagating the error to both the receive publisher and the send processor."
67299dbda23f7e5639814f7e,"Determines if the given `PropertyDescriptor` has a unique write method."
67299dbda23f7e5639814f7f,"Starts a background fetch operation if the current queue size is below a calculated threshold based on the maximum records per poll and the record buffer size."
67299dbda23f7e5639814f80,"Creates a new `SslHandler` with the specified `ByteBufAllocator` and `Executor` for delegated tasks."
67299dbda23f7e5639814f81,"Flushes the Base64 buffer by encoding any remaining bytes and writing them to the output stream, or throws an exception if decoding and the input is not properly padded."
67299dbda23f7e5639814f82,"Determines the element type of an array if the given ExpressionType is an array; otherwise, returns the original type."
67299dbda23f7e5639814f83,"Cancels the ongoing index populations due to a failure, ensuring each population is properly marked and logged as failed."
67299dbda23f7e5639814f84,"Adjusts the size of the object by the specified width and height increments."
67299dbda23f7e5639814f85,"Retrieves the value associated with the specified key, or returns the provided default value if the key is not found."
67299dbda23f7e5639814f86,"Finds the key associated with the specified value in the map, using either identity or equality comparison."
67299dbda23f7e5639814f87,"Processes the given form field value using a `RequestDataValueProcessor` if available, returning the potentially modified value."
67299dbda23f7e5639814f88,"Sets the prefix to be used for comments, ensuring it is not null or empty."
67299dbda23f7e5639814f89,"Ensures that the file is open, throwing an exception provided by the given supplier if it is not."
