67299dbda23f7e5639814e0e,"Tests the internal HTTP request functionality by verifying that the generated HTTP requests match the expected requests for various HTTP methods."
67299dbda23f7e5639814e0f,"Handles a definitive failure by tracking the exception and notifying the response listener."
67299dbda23f7e5639814e10,"Tracks a new exception by adding it to the suppressed exceptions of the current exception and updating the current exception."
67299dbda23f7e5639814e11,"Overrides the `restClientSettings` method to configure and return the settings for the REST client, including basic authentication using a predefined username and password."
67299dbda23f7e5639814e12,"Runs the provided script using the appropriate shell command for the current platform and returns the execution result."
67299dbda23f7e5639814e13,"Runs a Docker container with the specified distribution and returns the installation details."
67299dbda23f7e5639814e14,"Runs an Elasticsearch container using the specified distribution and Docker run configuration. This method executes the Docker run command, waits for Elasticsearch to start, and returns the installation details."
67299dbda23f7e5639814e15,"Creates an iterable of parameter arrays using the provided NamedXContentRegistry."
67299dbda23f7e5639814e16,"Starts the initializing shards for the given routing node and triggers a reroute in the cluster state."
67299dbda23f7e5639814e17,"Initiates a connection to the specified discovery node using the provided transport service."
67299dbda23f7e5639814e18,"Stops a random data node if available and returns true; otherwise, returns false."
67299dbda23f7e5639814e19,"Sets up a mock `TransportService` with a mock `ThreadPool` using a `ThreadPoolExecutor`."
67299dbda23f7e5639814e1a,"Rewrites the provided query using the given context and ensures that the rewritten query is serializable."
67299dbda23f7e5639814e1b,"Attempts to execute a code block repeatedly until it succeeds or a specified timeout is reached."
67299dbda23f7e5639814e1c,"Returns a string representation of the port range allocated for a worker, ensuring it falls within the valid private port range."
67299dbda23f7e5639814e1d,"Returns a non-deterministic SecureRandom instance configured for FIPS compliance, using a randomly generated 32-byte seed."
67299dbda23f7e5639814e1e,"Creates an index with the specified name using default settings."
67299dbda23f7e5639814e1f,"Adds unresponsive rules for all transport addresses associated with the given transport service for a specified duration."
67299dbda23f7e5639814e20,"Ensures that the given test cluster is healthy by verifying that there are no active disruptions, the expected number of nodes are present, and the cluster is fully connected."
67299dbda23f7e5639814e21,"Waits for all pending tasks on the specified RestClient to complete, excluding tasks filtered by the default task filter."
67299dbda23f7e5639814e22,"Resets the feature states if the cluster supports the necessary features and Machine Learning (ML) is enabled or the ML state reset fallback is supported."
67299dbda23f7e5639814e23,"Provides the default settings for the REST admin client, utilizing the same configuration as the REST client settings."
67299dbda23f7e5639814e24,"Updates the cluster settings using the provided `Settings` object."
67299dbda23f7e5639814e25,"Dispatches a REST request by creating a fake channel, stashing the current thread context, and ensuring the captured response is properly closed after processing."
67299dbda23f7e5639814e26,"Looks up a `MethodHandle` for a binary operation on two classes, promoting and unboxing the classes as necessary, and throws a `ClassCastException` if the operation cannot be applied."
67299dbda23f7e5639814e27,"Determines the appropriate method handle for normalizing index access based on the type of the receiver class, supporting arrays, maps, and lists."
67299dbda23f7e5639814e28,"Finds and returns the first non-null result obtained by applying a given function to elements of a collection, or null if no such result is found."
67299dbda23f7e5639814e29,"Checks and processes a user expression node within a semantic scope, ensuring the node has the appropriate decorations and throwing detailed exceptions if certain conditions are not met."
67299dbda23f7e5639814e2a,"Adds an additional field to the provided map if the specified property exists and the value is non-empty."
67299dbda23f7e5639814e2b,"Sets whether unmapped fields should be ignored in the query."
67299dbda23f7e5639814e2c,"Tests the encoding and decoding process of scaled float values to ensure that the original encoded value is accurately reconstructed after decoding and re-encoding using a randomly generated scaling factor."
67299dbda23f7e5639814e2d,"Stops the APM server, ensuring thread safety and logging the lifecycle event."
67299dbda23f7e5639814e2e,"Attempts to delete a file or directory at the specified path, retrying multiple times if necessary."
67299dbda23f7e5639814e2f,"Synchronizes the contents of the source directory with the destination directory by creating hard links for files."
67299dbda23f7e5639814e30,"Registers a client with a randomly generated client ID, secret, and redirect URI for testing purposes."
67299dbda23f7e5639814e31,"Pauses the execution of tasks, logs the reason for pausing, and the number of tasks that were cancelled."
67299dbda23f7e5639814e32,"Clears the allocation IDs by setting the previous shard routings to an empty list and returns whether any IDs were cleared."
67299dbda23f7e5639814e33,"Logs a debug message if the indexing of a watch document in the trigger service fails."
67299dbda23f7e5639814e34,"Removes a watch document from the trigger service if it belongs to the specified index before deletion."
67299dbda23f7e5639814e35,"Filters the provided settings to include only those that are allowed to be settable, based on a predefined list of allowed setting keys."
67299dbda23f7e5639814e36,"Registers a new execution with the given ID if the current executions are not sealed, returning true if the execution was successfully registered."
67299dbda23f7e5639814e37,"Pauses the current execution and clears the task queue, notifying the provided listener upon completion."
67299dbda23f7e5639814e38,"Clears all current executions and drains the executor's queue, returning the number of tasks that were cancelled."
67299dbda23f7e5639814e39,"Creates a tuple containing lists of triggered watches and their corresponding execution contexts from a collection of trigger events."
67299dbda23f7e5639814e3a,"Clears the current executions and asynchronously waits for them to complete before invoking the provided listener."
67299dbda23f7e5639814e3b,"Retrieves the concrete index metadata for a given index name from the provided metadata."
67299dbda23f7e5639814e3c,"Checks the provided time against the scheduled time and updates the scheduled time to the next occurrence if necessary, returning the previous scheduled time or -1 if the provided time is earlier than the scheduled time."
67299dbda23f7e5639814e3d,"Removes an entry from the provided map by its key and attempts to cast it to the specified type, throwing an exception if the type does not match."
67299dbda23f7e5639814e3e,"Moves the model identifier from task settings to service settings if it is not already present in the service settings."
67299dbda23f7e5639814e3f,"Parses the given XContentParser to position it at the token immediately following the specified field name, throwing an exception if the field is not found."
67299dbda23f7e5639814e40,"Calculates the time required to reserve a specified number of tokens."
67299dbda23f7e5639814e41,"Reserves the specified number of tokens and returns the time value indicating the wait time in microseconds until the tokens are available."
67299dbda23f7e5639814e42,"Tests that the shard status is correctly marked as complete on non-data nodes after a node shutdown operation is performed and verified."
67299dbda23f7e5639814e43,"Synchronously renews a retention lease for a specified leader shard and retention lease ID, returning an Optional containing a RetentionLeaseNotFoundException if the lease is not found."
67299dbda23f7e5639814e44,"Validates that the filtered settings of the leader and follower indices are identical, throwing an `IllegalArgumentException` if they are not."
67299dbda23f7e5639814e45,"Returns a view of the specified list based on the current offset and limit constraints, reversing the list if the limit is negative."
67299dbda23f7e5639814e46,"Determines if there are any candidates in the stages following the specified stage."
67299dbda23f7e5639814e47,"Extracts a substring from the given string that is located between two specified substrings, with options for greedy matching and case insensitivity."
67299dbda23f7e5639814e48,"Marks an error encountered during the retrieval of a policy for a specific index and records this error in the step information for the index."
67299dbda23f7e5639814e49,"Asynchronously records an ILM (Index Lifecycle Management) history item for indexing if ILM history is enabled."
67299dbda23f7e5639814e4a,"Identifies the most suitable rollup jobs for a given aggregation source from a set of available job capabilities."
67299dbda23f7e5639814e4b,"Freezes the current time of the ClockMock instance, setting it to the current instant."
67299dbda23f7e5639814e4c,"Unfreezes the clock, resetting it to the current system time in the current time zone."
67299dbda23f7e5639814e4d,"Advances the current time by the specified number of seconds."
67299dbda23f7e5639814e4e,"Rewinds the current time by the specified number of seconds."
67299dbda23f7e5639814e4f,"Determines if the current status is active by evaluating if it has started or is relocating."
67299dbda23f7e5639814e50,"Checks if the feature is allowed and starts tracking its usage if permitted."
67299dbda23f7e5639814e51,"Checks if the current feature is allowed without tracking the usage."
67299dbda23f7e5639814e52,"Updates the last checked timestamp and conditionally updates the last met condition timestamp or resets the acknowledgment status of actions based on the provided condition."
67299dbda23f7e5639814e53,"Creates a prepared rounding instance using the interval's string representation and the specified time zone."
67299dbda23f7e5639814e54,"Determines if the given expression is valid based on predefined validation rules."
67299dbda23f7e5639814e55,"Creates a response by indexing the given document ID and headers, and notifies the provided listener upon completion."
67299dbda23f7e5639814e56,"Retrieves the response for a given asynchronous execution ID, optionally restoring response headers, and notifies the provided listener with the result."
67299dbda23f7e5639814e57,"Sets the internal user for authentication using the specified transport version and node name."
67299dbda23f7e5639814e58,"Checks if the specified action is permitted by any of the groups, considering special privileges for mapping update actions."
67299dbda23f7e5639814e59,"Validates the given application name to ensure it adheres to the required naming conventions, disallowing wildcards."
67299dbda23f7e5639814e5a,"Verifies if the provided data matches the given hash using the appropriate hashing algorithm."
67299dbda23f7e5639814e5b,"Writes the encoded authentication information to the provided thread context, ensuring that no authentication data is already present in the context."
67299dbda23f7e5639814e5c,"Generates a bcrypt salt string using the specified number of log rounds and a default secure random number generator."
67299dbda23f7e5639814e5d,"Generates a salt string using the default log2 rounds."
67299dbda23f7e5639814e5e,"Determines if checkpoint alignment is disabled based on the provided settings configuration."
67299dbda23f7e5639814e5f,"Creates a BitSet mask indicating which fields in each row of a list of lists are considered ""short"" based on a specified length threshold."
67299dbda23f7e5639814e60,"Calculates the cumulative Levenshtein distance between corresponding fields of two rows represented as lists of strings."
67299dbda23f7e5639814e61,"Calculates the weights for each matched format based on their ability to merge with timestamp matches and the preface length, optimizing the process by terminating early if the leading weight cannot be surpassed by remaining matches."
67299dbda23f7e5639814e62,"Determines if a given sample text can be classified as text based on the presence of newlines and a minimum number of non-blank lines."
67299dbda23f7e5639814e63,"Replaces matching expressions in the target list with replacements derived from a pattern, using a specified replacer function, and returns whether any modifications were made."
67299dbda23f7e5639814e64,"Combines a list of query builders into a single query using the specified clause, optimizing for cases where only one query is provided."
67299dbda23f7e5639814e65,"Converts a given long value to an unsigned representation as a Number."
67299dbda23f7e5639814e66,"Counts the number of consecutive coordinates at the end of the array that match the first coordinate, comparing them as 2D integer values."
67299dbda23f7e5639814e67,"Adjusts the breaker by a specified delta, potentially tripping the circuit breaker if the delta is positive and exceeds the limit."
67299dbda23f7e5639814e68,"Calculates the median of a specified range of integer values from an `IntBlock`, handling both odd and even counts by returning the middle value or the average of the two middle values without overflow."
67299dbda23f7e5639814e69,"Determines if the rounding process can complete within the specified range without exceeding the upper limit."
67299dbda23f7e5639814e6a,"Evaluates the given block by processing each position to determine the ascending nullable value, appending the result to a new block, and returning the constructed block."
67299dbda23f7e5639814e6b,"Schedules snapshot jobs based on the current cluster state by retrieving and processing snapshot configurations from the cluster's metadata."
67299dbda23f7e5639814e6c,"Generates a sorted set of random, non-overlapping byte ranges within a specified length."
67299dbda23f7e5639814e6d,"Finishes processing by marking all bytes as accounted for and releasing resources, ensuring that the correct number of permits are available."
67299dbda23f7e5639814e6e,"Determines if a node is safe to shut down by evaluating its current state and tasks."
67299dbda23f7e5639814e6f,"Finishes the reporting process by flushing data with an immediate refresh policy, handling any interruptions that occur during the process."
67299dbda23f7e5639814e70,"Vacates the node by isolating the datafeed and marking the task as locally aborted with the given reason."
67299dbda23f7e5639814e71,"Determines the common prefix of a specified byte array segment, starting from a given offset and extending for a specified length, and returns an `OptionalInt` representing the value associated with the prefix if a leaf node is encountered."
67299dbda23f7e5639814e72,"Returns the top transaction IDs based on the transaction counts."
67299dbda23f7e5639814e73,"Retrieves the top item IDs based on their counts."
67299dbda23f7e5639814e74,"Calculates the natural logarithm of the probability of observing a given number of successes in a fixed number of independent Bernoulli trials, each with the same probability of success."
67299dbda23f7e5639814e75,"Calculates the natural logarithm of the binomial probability for given parameters."
67299dbda23f7e5639814e76,"Determines if the data has been refreshed recently based on the last update time and staleness duration."
67299dbda23f7e5639814e77,"Retrieves the memory requirement for an anomaly detector job based on the specified job ID."
67299dbda23f7e5639814e78,"Retrieves the memory requirement for a specified data frame analytics job by its ID."
67299dbda23f7e5639814e79,"Refreshes the state of machine learning tasks by updating the memory tracker with the latest information from persistent tasks metadata. This method initiates a refresh process and ensures that only one refresh operation is in progress at any given time. Upon completion, it notifies the provided `ActionListener`."
67299dbda23f7e5639814e7a,"Waits for a flush acknowledgement associated with the specified flush ID within the given timeout period, returning null if the operation fails or the flush is not acknowledged in time."
67299dbda23f7e5639814e7b,"Builds and returns a TimeRange object based on the provided start and end parameters."
67299dbda23f7e5639814e7c,"Deletes all annotations associated with the job and notifies the provided listener upon completion."
67299dbda23f7e5639814e7d,"Persists a bucket by removing its nested records and indexing it, along with its influencers, into the appropriate storage."
67299dbda23f7e5639814e7e,"Deletes interim results for the specified job."
67299dbda23f7e5639814e7f,"Flushes pending write operations if the channel is open, otherwise notifies the listener of a completed response."
67299dbda23f7e5639814e80,"Tests the inflation of H3 cells with a specific address at varying precisions, ensuring that the inflated bounding boxes match expected bounds for different inflation factors."
67299dbda23f7e5639814e81,"Sets the value of a geospatial tile in the provided `GeoShapeCellValues` object if the specified tile coordinates are valid for the given precision, and returns the number of tiles set."
67299dbda23f7e5639814e82,"Determines if the specified bounding box intersects with the current geometric shape."
67299dbda23f7e5639814e83,"Determines the spatial relationship between a point and a geometric area, returning whether the point is disjoint from the area or its specific relation using Cartesian coordinates."
67299dbda23f7e5639814e84,"Determines the highest generation number from a list of segment file names, excluding old segment generations."
67299dbda23f7e5639814e85,"Skips the final output from the given DataInput stream."
67299dbda23f7e5639814e86,"Generates a valid random instance name that does not produce an error when validated."
67299dbda23f7e5639814e87,"Creates a user with the ""run as"" role using basic authentication headers."
67299dbda23f7e5639814e88,"Invalidates all tokens associated with the specified realm."
67299dbda23f7e5639814e89,"Determines the part number corresponding to a given position within a file, ensuring the position is valid and within the file's length."
67299dbda23f7e5639814e8a,"Removes the specified cache key from the cache, effectively invalidating the associated cached data."
67299dbda23f7e5639814e8b,"Marks the current context as failed by logging the provided exception and failure message."
67299dbda23f7e5639814e8c,"Resolves the given expression into a set of root attribute expressions, utilizing provided aliases for resolution."
67299dbda23f7e5639814e8d,"Constructs a FieldAttribute with a keyword type for the specified field name."
67299dbda23f7e5639814e8e,"Increments the translation metric counter, updating the relevant time-based buckets to reflect the current state."
67299dbda23f7e5639814e8f,"Converts a date string into a `ZonedDateTime` object representing the start of the day in UTC, based on the provided date format."
67299dbda23f7e5639814e90,"Prints a message to the output writer with the specified verbosity level, ensuring the message is flushed immediately."
67299dbda23f7e5639814e91,"Converts IJK coordinates on a specified face and resolution to geographic coordinates (latitude and longitude)."
67299dbda23f7e5639814e92,"Normalizes the instance variables i, j, and k by subtracting the minimum value among them from each."
67299dbda23f7e5639814e93,"Determines the neighboring position based on the given digit and updates the current coordinates accordingly if the digit is within a valid range."
67299dbda23f7e5639814e94,"Converts the current IJK coordinates on a specified face to geographic coordinates (latitude and longitude) at a given resolution."
67299dbda23f7e5639814e95,"Calculates the number of child H3 indexes for a given H3 address at a specified child resolution."
67299dbda23f7e5639814e96,"Calculates the number of non-intersecting child hexagons for a given H3 address."
67299dbda23f7e5639814e97,"Returns the H3 index for the north polar region at the specified resolution."
67299dbda23f7e5639814e98,"Returns the H3 index for the south polar region at the specified resolution."
67299dbda23f7e5639814e99,"Calculates the maximum latitude reached by the great circle path between this point and the specified `LatLng` point."
67299dbda23f7e5639814e9a,"Calculates the minimum latitude along the great circle path between this point and the specified `LatLng` point."
67299dbda23f7e5639814e9b,"Converts 2D hexagonal coordinates to geographic coordinates based on the specified face, resolution, and substrate grid option."
67299dbda23f7e5639814e9c,"Rotates the given H3 index 60 degrees counter-clockwise at each resolution level.This function iterates through each resolution of the H3 index, applying a 60-degree counter-clockwise rotation to the index digit.The modified H3 index is then returned."
67299dbda23f7e5639814e9d,"Consumes the provided coordinates by creating or resetting a `PointError` object and processing it."
67299dbda23f7e5639814e9e,"Encodes a given hash string into a long value using a base-32 encoding scheme."
67299dbda23f7e5639814e9f,"Encodes the given longitude and latitude into a geohash string with a default precision level of 12."
67299dbda23f7e5639814ea0,"Encodes the given latitude and longitude into a geohash string representation at the specified precision level."
67299dbda23f7e5639814ea1,"Tests the retrieval of resources with the same name from both a parent class loader and an embedded class loader, ensuring that both resources are correctly loaded and accessible."
67299dbda23f7e5639814ea2,"Checks the manifest of a JAR file to ensure it does not require a newer Java version than is currently available."
67299dbda23f7e5639814ea3,"Checks that the specified range of the key array is ordered and that the associated values arrays are correctly correlated with the key array."
67299dbda23f7e5639814ea4,"Sorts the specified key array and rearranges the corresponding elements of the provided values arrays to maintain their association with the key elements."
67299dbda23f7e5639814ea5,"Compresses the data structure by merging new values into the existing dataset."
67299dbda23f7e5639814ea6,"Finds the Elastic APM agent JAR file in the current working directory, returning its path if found, or null if the module is not present in a non-production environment."
67299dbda23f7e5639814ea7,"Forces the termination of the associated JVM process, ensuring that all resources are properly released."
67299dbda23f7e5639814ea8,"Returns a list of versions that are compatible with the current index, filtered to include only those supported by the current architecture and platform."
67299dbda23f7e5639814ea9,"Checks that the number of unassigned persistent tasks in the given cluster state matches the expected number."
67299dbda23f7e5639814eaa,"Creates a `PersistentTasksClusterService` using the provided assignment function to determine task assignments based on task parameters, candidate nodes, and the current cluster state."
67299dbda23f7e5639814eab,"Returns an `Optional` containing the first `Error` found by unwrapping the causes and suppressed exceptions of the given `Throwable`, or an empty `Optional` if no `Error` is found."
67299dbda23f7e5639814eac,"Collects and returns a list of absolute paths to shard data directories from the provided array of data paths."
67299dbda23f7e5639814ead,"Initializes the builder as a new index with empty shard routing tables, using the provided index metadata."
67299dbda23f7e5639814eae,"Cancels the relocation of a given shard, updates its state, and returns the updated shard routing."
67299dbda23f7e5639814eaf,"Resolves a set of index expressions against the given cluster state using lenient options for expanding open indices."
67299dbda23f7e5639814eb0,"Determines if the provided collection of aliases or indices represents all indices."
67299dbda23f7e5639814eb1,"Closes the resource, waiting up to 30 seconds for all in-flight requests to complete before returning."
67299dbda23f7e5639814eb2,"Returns a list of task groups, building them if they have not been initialized."
67299dbda23f7e5639814eb3,"Scales down the given value by a predefined probability if sampling is enabled."
67299dbda23f7e5639814eb4,"Scales up the given value based on the sampling probability."
67299dbda23f7e5639814eb5,"Converts a long hash into a string representation of zoom, x, and y tile coordinates, ensuring the validity of the coordinates."
67299dbda23f7e5639814eb6,"Adds a range to the aggregation with an unbounded lower limit and an upper limit specified by the given key and 'to' value."
67299dbda23f7e5639814eb7,"Adds an unbounded range starting from the specified value to the aggregation builder."
67299dbda23f7e5639814eb8,"Retrieves a `LeafBucketCollector` for the given `LeafReaderContext`, updating the competitive bounds listener if necessary."
67299dbda23f7e5639814eb9,"Submits a task to the cluster service to record the migration status of a feature, indicating whether it was successful or failed."
67299dbda23f7e5639814eba,"Returns the value of the specified field as a byte array."
67299dbda23f7e5639814ebb,"Retrieves the current retention leases without expiring them."
67299dbda23f7e5639814ebc,"Retrieves the current retention leases without expiring any leases."
67299dbda23f7e5639814ebd,"Checks if the given string is not null and has a length greater than zero."
